Unnamed: 0,ID,Sentence,Readability_Level_19,Unnamed: 3,عدد الكلمات,تهجئة/إملاء,تصريف واشتقاق,تراكيب نحوية,مفردات,فكرة / محتوى,ملاحظات,99,annotator,reasoning_round,98,95,100,Unnamed: 11,Orthography,word count,Morphology,syntactic,vocab,content
464,30500190071,لقد أصبحت العلاقة بين الماء والغذاء مصدر قلق عالميٍّ كبيرٍ مع تزايد عدد سكان العالم ونمو ثرواته،,14,ن (صف 8-9),,,,,مفردات قانونية، علمية، دينية، سياسية،... غير متخصصة/عامة,,,1.0,Samar,8.0,,,,,,,,,V,
465,30500210040,الموارد المائية في دول مجلس التعاون لدول الخليج العربية,14,ن (صف 8-9),,,,,مفردات قانونية، علمية، دينية، سياسية،... غير متخصصة/عامة,,,1.0,Samar,8.0,,,,,,,,,V,
466,30600030003,2 أَمَّا يُوحَنَّا فَلَمَّا سَمِعَ فِي السِّجْنِ بِأَعْمَالِ الْمَسِيحِ، أَرْسَلَ اثْنَيْنِ مِنْ تَلاَمِيذِهِ،,13,م (صف 6-7),,,,الجمل شرطية ( مركبة - عادية),,,,1.0,Samar,8.0,,,,,,,,S,,
467,30600130008,7 وَحِينَمَا تُصَلُّونَ لاَ تُكَرِّرُوا الْكَلاَمَ بَاطِلاً كَالأُمَمِ، فَإِنَّهُمْ يَظُنُّونَ أَنَّهُ بِكَثْرَةِ كَلاَمِهِمْ يُسْتَجَابُ لَهُمْ.,14,ن (صف 8-9),,,,,مفردات قانونية، علمية، دينية، سياسية،... غير متخصصة/عامة,,,1.0,Samar,8.0,,,,,,,,,V,
468,30600130022,21 لأَنَّهُ حَيْثُ يَكُونُ كَنْزُكَ هُنَاكَ يَكُونُ قَلْبُكَ أَيْضًا.,12,ل (صف 5),,,,,مفردات فصيحة - سامر ٣,,,1.0,Samar,8.0,,,,,,,,,V,
469,31000290002,قَالَ حَدَّثَنَا عَبْدُ الْوَاحِدِ ،,6,و (صف 2),,,الفعل الماضي المفرد والجمع,جملة فيها فعلين (مثلا جملة فعلية مفعولها أن المصدرية),,,,1.0,Samar,8.0,,,,,,,M,S,,
470,31100060013,ثم جئت أنا بعد مدة طويلة من السفر فسألت عن ولدي وعن أمه,10,ي (صف 4),١٥ هو أعلى عدد كلمات مطبعية غير متكررة بدون علامات الترقيم,,,,,,,1.0,Samar,8.0,,,,,,W,,,,
471,10100060068,أبي.. أبي..,3,ج (صف 1),,,لواحق: ضمير المتكلم المفرد المتصل,,,,,1.0,Samar,8.0,,,,,,,M,,,
472,10300050043,وَهُنَاكَ شَاهَدَ الْأَخُ الْكَبِيرُ الذَّهَبَ وَالْفِضَّةَ مُكَدَّسَةً فِي كُلِّ مَكَانٍ.,8,ح (صف 3),,,سوابق أخرى: سين الاستقبال ، واو الاستئناف، فاء العطف,,,,,1.0,Samar,8.0,,,,,,,M,,,
473,10400100105,أُلَوِّنُ المُرَبَّعَ تَحْتَ صورَةِ المَرافِقِ الَّتي أَحْتاجُها بالْقُرْبِ مِنَ الْمَسْكَنِ الَّذي أَعيْشُ فِيْهِ:,10,ي (صف 4),,,,,أسماء الوصل المفردة,,,1.0,Samar,8.0,,,,,,,,,V,
474,10700010073,السيارة الصغيرة تسابق السيارة السريعة في سباق مثير.,5,هـ (صف 2),٨ هو أعلى عدد كلمات مطبعية غير متكررة بدون علامات الترقيم,,,,,,,1.0,Samar,8.0,,,,,,W,,,,
475,20100040039,ثم صاغ مصطلح تبديل الرزم، وطبّقه بشكلٍ عمليّ في شبكة مختبر الفيزياء القومي في 5 أغسطس 1968م.,14,ن (صف 8-9),,,,,مفردات قانونية، علمية، دينية، سياسية،... غير متخصصة/عامة,,,1.0,Samar,8.0,,,,,,,,,V,
476,20100120036,لا تزال محفوظة حتى أيامنا هذه.,10,ي (صف 4),,,,كان وأخواتها,,,,1.0,Samar,8.0,,,,,,,,S,,
477,20400320028,أوعيةُ الثّمرِ.,7,ز (صف 2),,,جمع التكسير,,,,,1.0,Samar,8.0,,,,,,,M,,,
478,20400400001,الوَحْدَةُ الرّابِعَةُ,5,هـ (صف 2),,كلمات من ٤ مقاطع (بدون حساب حركات الإعراب),,,العدد الترتيبي,,,1.0,Samar,8.0,,,,,O,,,,V,
479,20500020001,يكون هذا أكثر وضوحًا في إيصالات التسوق وفي المستندات التي تستخدم أيضًا أرقامًا أخرى بها فواصل عشرية، مثل القياسات.,14,ن (صف 8-9),,,,,مفردات قانونية، علمية، دينية، سياسية،... غير متخصصة/عامة,,,1.0,Samar,8.0,,,,,,,,,V,
480,20900010019,لأن السعودية كانت تساعد المسلمين في البوسنة خلال وبعد الحرب.,10,ي (صف 4),,,,"كان وأخواتها, إن وأخواتها",,,,1.0,Samar,8.0,,,,,,,,S,,
481,30100100023,لم يشغل والدي نفسه قط بجمع الثروة، وقد ترك لنا عند وفاته قدرًا يسيرًا من الأملاك.,12,ل (صف 5),,,,,(بل - بلى - أجل - قط),,,1.0,Samar,8.0,,,,,,,,,V,
482,30100180006,فبتْنا ليلتنا فيه على أشدِّ ما يكون من الخوف إلى أن طلع الفجر،,13,م (صف 6-7),,,,,كلمات تصف حالات نفسية عميقة مثل الاكتئاب، الضياع، الاستنفار النفسي,,,1.0,Samar,8.0,,,,,,,,,V,
483,30300010012,ومع أن عنوان القصة يركز على محبة هاملت لأبيه المغتال (وبصورة غير مباشرة أو رمزية على انخراط لافورغ في الانتماء إلى عمل شكسبير)، فإن النص بكامله موجه وجهة أخرى.,14,ن (صف 8-9),,,,,مفردات فصيحة - سامر ٤,,,1.0,Samar,8.0,,,,,,,,,V,
484,30700010005,3 وَقَالَ اللهُ: «لِيَكُنْ نُورٌ»، فَكَانَ نُورٌ.,12,ل (صف 5),,,,,مفردات فصيحة - سامر ٣,,,1.0,Samar,8.0,,,,,,,,,V,
485,10102480016,هذه البيوت الأربعة مقامة على شاطئ البحر..,7,ز (صف 2),,,جمع التكسير,,,,,1.0,Samar,8.0,,,,,,,M,,,
486,10102510005,طلبت من أبي أن يشتري لي جهازًا مثلهم، ولكنه قال إن ظروفه المادية لا تسمح بذلك،,11,ك (صف 4),٢٠ هو أعلى عدد كلمات مطبعية غير متكررة بدون علامات الترقيم,,,,,,,1.0,Samar,8.0,,,,,,W,,,,
487,10400080005,أُسَمِّعَ سورَةَ النّاسِ.,13,م (صف 6-7),,,,,,تعابير ثقافية محلية قد لا يفهمها من لا يشترك في نفس الثقافة.,,1.0,Samar,8.0,,,,,,,,,,C
488,10400320104,نَدْعو لَهُمْ بِالْبقَاءْ,7,ز (صف 2),,أفعال/أسماء معتلة الآخر,,,,,,1.0,Samar,8.0,,,,,O,,,,,
489,10600550030,اكتشف واقرأ,7,ز (صف 2),,,فعل الأمر المفرد,,,,,1.0,Samar,8.0,,,,,,,M,,,
490,10600550037,فلنكتشف يا صديق,9,ط (صف 3),,,,المنادى,,,,1.0,Samar,8.0,,,,,,,,S,,
491,30100230048,لم أرَكَ منذ لقائنا الأخير في فرنسا!,8,ح (صف 3),,,,,أحرف النفي,,,1.0,Samar,8.0,,,,,,,,,V,
492,30100330008,كانت المشكلة الأخلاقية عند اليونان وكيف ينبغي أن يكون عليه سلوك الإنسان ليبلغ كماله، هي أول ما يَشغل الناس من مشكلات،,14,ن (صف 8-9),,,,,مفردات قانونية، علمية، دينية، سياسية،... غير متخصصة/عامة,,,1.0,Samar,8.0,,,,,,,,,V,
493,30100330058,لو كان لإقليدس تلميذٌ مثل لوباتشفسكي — مثلًا — يتنبَّه وقتئذٍ إلى أن نظريات أستاذه إنما تستمدُّ صِدقها من طريقة اشتقاقها من الفروض، أما أن تكون صادقة أو غير صادقة على الطبيعة فذلك ما ليس في وُسْع الهندسة نفسها أن تقوله،,16,ع (صف 12),,,,,مفردات متخصصة ومفردات عربية عالية غير شائعة كثيرا في الفضاء العام. مفردات في الغالب بعيدة عن اللهجات العامية.,,,1.0,Samar,8.0,,,,,,,,,V,
494,30200280013,تحتاج إلى حيز مكاني واسع لحفظ المعلومات  (أ) الأرشفة المحوسبة  (ب) الأرشفة التقليدية  (ج) الأرشفة الإلكترونية  (د) الوسائط المحوسبة,14,ن (صف 8-9),,,,,مفردات قانونية، علمية، دينية، سياسية،... غير متخصصة/عامة,,,1.0,Samar,8.0,,,,,,,,,V,
495,30500070022,ولذلكَ ينبِّهنا سبحانَهُ إلى الإكثارِ منَ الأعمالِ الصّالحةِ؛ لأنَّ ثوابَها خالدٌ أبدًا،,12,ل (صف 5),,,,,مفردات فصيحة - سامر ٣,,,1.0,Samar,8.0,,,,,,,,,V,
496,30500300035,نريد القراءة في كل مدرسة ودائرة ومكتب وبيت، وفي كل مرافقنا وحدائقنا وشوارعنا.,9,ط (صف 3),١٢ هو أعلى عدد كلمات مطبعية غير متكررة بدون علامات الترقيم,,,,,,,1.0,Samar,8.0,,,,,,W,,,,
497,30900020018,قالـتْ لـه النــفــسُ :إنِّــي لا أرَى طَــمعًا وإنَّ مَــوْلاكَ لــم يَــسْــلــمْ ولـــم يَـــصِـــدِ,15,س (صف 10-11),,,,,المفردات المتخصصة التي لا تكفي معرفة الكلمة وحدها لفهمها، وإنما يحتاج إلى معرفة الفكرة/المفهوم لفهمها,,,1.0,Samar,8.0,,,,,,,,,V,
498,10100310004,صنعاء – اليمن,3,ج (صف 1),,كلمات من ٣ مقاطع (بدون حساب حركات الإعراب),سوابق: ال التعريف,,,,,,Sawsan,1.0,,,1.0,,O,,M,,,
499,10100400051,جلس حمدان وأبوه بين أفراد العائلة،,7,ز (صف 2),,,جمع التكسير,مفعول فيه (ظروف زمان ومكان),,,,,Sawsan,1.0,,,1.0,,,,M,S,,
500,10100630012,إذ نلاحظ أن كريات الدم الحمراء التي تحمل الغذاء إلى جميع أجزاء الجسم، قد تغير شكلها في الفضاء..,12,ل (صف 5),,,,,مفردات فصيحة - سامر ٣,,,,Sawsan,1.0,,,1.0,,,,,,V,
501,10100670006,ثم نبح نباحًا عاليًا وقال: انظروا إلى قوامي البديع وإلى رشاقتي وبراعتي وجمال صوتي!!,12,ل (صف 5),,,,,مفردات فصيحة - سامر ٣,,"تبرير مستوى ""ل"" أن كلمة ""قوامي"" فصيحة، الأفضل وضعها في مستوى ""ي"" والتبرير: جملة مقول القول في محل نصب مفعول به + عدد الكلمات. ",,Sawsan,1.0,,,1.0,,,,,,V,
502,10100690090,قال تعالى في سورة الشورى: (وأمرهم شورى بينهم),13,م (صف 6-7),,,,,آخر - مفردات,,,,Sawsan,1.0,,,1.0,,,,,,V,
503,10100760053,قالت القطة الأم: هذا يعتمد على سرعتك!,6,و (صف 2),,,الفعل الماضي المفرد والجمع,,,,,,Sawsan,1.0,,,1.0,,,,M,,,
504,10100780052,الشفاط ليس جيدًا..,10,ي (صف 4),,,,كان وأخواتها,,,,,Sawsan,1.0,,,1.0,,,,,S,,
505,10100930045,إن مدينة الوادي المعروفة بهندستها المعمارية الأصلية، وصناعتها، وبتمورها التي لا مثيل لها، قد تأثرت تأثرًا عميقًا بالثقافة الإسلامية.,14,ن (صف 8-9),,,,,"مفردات قانونية، علمية، دينية، سياسية،... غير متخصصة/عامة, مفردات فصيحة - سامر ٤",,,,Sawsan,1.0,,,1.0,,,,,,V,
506,10101020021,أنا لا أخفي عليك شيئًا صغيرًا أو كبيرًا.,8,ح (صف 3),,,(ثم  ، حتى  ، أو  ، أم  ، لكن  ، أمّا),,أحرف النفي,,,,Sawsan,1.0,,,1.0,,,,M,,V,
507,10101150003,يرسمها: عبد العال,5,هـ (صف 2),,,,جملة فعلية مع مفعول به واحد اسم,,,,,Sawsan,1.0,,,1.0,,,,,S,,
508,10101170169,"وقوله صلى الله عليه وسلم: ""المؤمن القوي خير وأحب إلى الله من المسلم الضعيف، وفي كل خير"".",12,ل (صف 5),,,,جمل اعتراضية  ( تفسير- دعاء...),مفردات فصيحة - سامر ٣,,,,Sawsan,1.0,,,1.0,,,,,S,V,
509,10101290015,تساءل رئيس القاعدة في دهشة: - ترى من وراء اختفاء هذا المكوك؟,10,ي (صف 4),,,المبني للمجهول,,,,,,Sawsan,1.0,,,1.0,,,,M,,,
510,10101290028,نظر الناس نحوه بدهشة، فعلق: - نحن في عصر السرعة..,11,ك (صف 4),,,,إضافة خيالية (لفظية) طويل القامة,,,,,Sawsan,1.0,,,1.0,,,,,S,,
511,10101330003,انتبه!,6,و (صف 2),,,الفعل الماضي المفرد والجمع,,,,"انتبه! تُقرأ فعل أمر مستوى  ""ز"" أما إذا قُرأت انتبهَ فعل ماضي توضع مستوى و",,Sawsan,1.0,,,1.0,,,,M,,,
512,10101390031,"و""المركز"" حيث توجد قوى رهيبة من المد والجزر، تتراكم فيه كل مادة الثقب الأسود.",14,ن (صف 8-9),,,,,"مفردات قانونية، علمية، دينية، سياسية،... غير متخصصة/عامة, مفردات فصيحة - سامر ٤",,,,Sawsan,1.0,,,1.0,,,,,,V,
513,10101470015,فانفتح شق في الأرض مثل البئر العميقة له سلم طويل.,8,ح (صف 3),,,سوابق أخرى: سين الاستقبال ، واو الاستئناف، فاء العطف,,,,,,Sawsan,1.0,,,1.0,,,,M,,,
514,10101520021,علينا نحن أن نقوم بدورنا قبل كل شيء، للحفاظ على كوكبنا.,10,ي (صف 4),,,,خبر مقدم / مبتدأ مؤخر,,,,,Sawsan,1.0,,,1.0,,,,,S,,
515,10101560014,تزوج إسماعيل امرأة أخرى،,7,ز (صف 2),,أفعال/أسماء معتلة الآخر,,,,,,,Sawsan,1.0,,,1.0,,O,,,,,
516,10102740021,ما هذا التخريف؟,12,ل (صف 5),,,,,مفردات فصيحة - سامر ٣,,"جملة استفهامية مستوى ""ه"" لا مبرر لرفعها إلى ""ل"" إلا إذا اعتبرنا كلمة ""تخريف فصيحة""",,Sawsan,1.0,,,1.0,,,,,,V,
517,10102770018,5- شيء من التاريخ,8,ح (صف 3),,,,,مفردات فصيحة - سامر ١ و سامر ٢,,"مستوى ""د"" جار ومجرور لا يوجد معيار محدد في مستوى ""ح""",,Sawsan,1.0,,,1.0,,,,,,V,
518,10102810005,وعبثًا ذهبت محاولات الجميع في معرفة مكانها..,12,ل (صف 5),,,,,مفردات فصيحة - سامر ٣,,,,Sawsan,1.0,,,1.0,,,,,,V,
519,10102890007,ذات يوم ذهب مسعود الى الحظيرة ليصحب حماره إلى الطاحونة، لكن الحمار ظل واقفًا لا يتحرك من مكانه،,11,ك (صف 4),٢٠ هو أعلى عدد كلمات مطبعية غير متكررة بدون علامات الترقيم,,,,,,,,Sawsan,1.0,,,1.0,,,W,,,,
520,10102890017,"ولما رأى الحمار والدموع تكاد تسقط من عينيه من شدة الإجهاد قال له: ""استرح..",13,م (صف 6-7),,,,,كلمات تصف حالات نفسية عميقة مثل الاكتئاب، الضياع، الاستنفار النفسي,,"مستوى ""ي"" لأنّ ""كاد"" من النواسخ، وجملة مقول القول في محل نصب مفعول به",,Sawsan,1.0,,,1.0,,,,,,V,
521,10200880003,يستخدم في فصل البذور عن القش قديما  (أ) محراث  (ب) الشاعوب  (ج) مذارة,12,ل (صف 5),,,,,مفردات فصيحة - سامر ٣,,,,Sawsan,1.0,,,1.0,,,,,,V,
522,10300540006,قالت بيث البالغة من العمر ثلاثة عشر عامًا في سرور وهي جالسة في زاوية الغرفة: «لكن لدينا أمٌّ وأبٌ يحباننا كثيرًا، ولطالما كنا معًا.»,13,م (صف 6-7),,,,,كلمات تصف حالات نفسية عميقة مثل الاكتئاب، الضياع، الاستنفار النفسي,,,,Sawsan,1.0,,,1.0,,,,,,V,
523,10400400050,وَفَجْأَةً سَقَطَتْ كُرَةٌ مِنَ البَيْتِ المُجاوِرِ!,8,ح (صف 3),,,سوابق أخرى: سين الاستقبال ، واو الاستئناف، فاء العطف,المفعول المطلق,,,,,Sawsan,1.0,,,1.0,,,,M,S,,
524,10400410120,يَدْعو .,7,ز (صف 2),,أفعال/أسماء معتلة الآخر,,,,,,,Sawsan,1.0,,,1.0,,O,,,,,
525,10500110005,حكم بلاد الصين في قديم الزمان ملك كريم الأخلاق، طيب القلب، واسع الغنى.,11,ك (صف 4),,,,إضافة خيالية (لفظية) طويل القامة,,,,,Sawsan,1.0,,,1.0,,,,,S,,
526,10500300028,ذهبت هذه الكلمات وغيرها ضياعًا،,7,ز (صف 2),,,,حال,مفردات فصيحة شائعة - سامر ٢,,,,Sawsan,1.0,,,1.0,,,,,S,V,
527,10500340038,ويجب أن أفي بنذري، وأصدق في وعدي، وأنفذ كل كلمةٍ قلتها، وأوعدت بها.,12,ل (صف 5),,,,,مفردات فصيحة - سامر ٣,,,,Sawsan,1.0,,,1.0,,,,,,V,
528,10500370058,فقد كرهت هذه المواكب التي تقيدني..,10,ي (صف 4),,,,جملة الصلة وجملة الصفة- جملة الحال-جملة المفعول به,"(قد – لقد), أسماء الوصل المفردة",,,,Sawsan,1.0,,,1.0,,,,,S,V,
529,10500550015,وكان مما يثير دهشتها، أن الغابات خضر على وجه الأرض وأن الأزهار فيها يتضوع منها عطر لا تثبته تحت الماء.,13,م (صف 6-7),,,,,كلمات تصف حالات نفسية عميقة مثل الاكتئاب، الضياع، الاستنفار النفسي,,,,Sawsan,1.0,,,1.0,,,,,,V,
530,10500550027,فقالت لهن فيما قالت: - ‹‹ما أجمل الشواطئ مفروشة بالرمال تنكسر عندها أمواج البحر!,10,ي (صف 4),,,,جملة الصلة وجملة الصفة- جملة الحال-جملة المفعول به,(ممّا – عمّا – عمَّ – علامَ – فيمَ – إلامَ - بمَ...),,,,Sawsan,1.0,,,1.0,,,,,S,V,
531,10500580026,"فقال الصغير أسعد: ""يدهشني أن يحطم القوم الأشجار في رؤوس الجبال! "" ",10,ي (صف 4),,,,جملة الصلة وجملة الصفة- جملة الحال-جملة المفعول به,,,,,Sawsan,1.0,,,1.0,,,,,S,,
532,10500610011,لذلك اعتاد الناس أن يسموه ‹‹وادي الكنوز››.,7,ز (صف 2),,أفعال/أسماء معتلة الآخر,جمع التكسير,,,,,,Sawsan,1.0,,,1.0,,O,,M,,,
533,10600430002,يا صانع السلام,9,ط (صف 3),,,,المنادى,,,,,Sawsan,1.0,,,1.0,,,,,S,,
534,20100560025,والمسجد كله غير مسقّف سوى بناء قبة الصخرة والمصلى القبلي الجامع والمصلى المرواني.,14,ن (صف 8-9),,,,التوكيد المعنوي,مفردات قانونية، علمية، دينية، سياسية،... غير متخصصة/عامة,,,,Sawsan,1.0,,,1.0,,,,,S,V,
535,20100710002,وقد اشتهر النادي عبر تاريخه بفريقه لكرة القدم الذي يعتبر أقوى وأكثر فرق كرة القدم الألمانية تتويجاً بالألقاب حتى يومنا هذا، حيث نجح النادي في الفوز بالدوري المحلي 33 مرة (إحدى عشرة منها متتالية في المواسم الأحد عشر الأخيرة)، وبكأس ألمانيا في 20 مناسبة،,14,ن (صف 8-9),,,,,"مفردات فصيحة - سامر ٤, مفردات قانونية، علمية، دينية، سياسية،... غير متخصصة/عامة",,,,Sawsan,1.0,,,1.0,,,,,,V,
536,20100880023,ويُقال بأن الحضارة التي ازدهرت في هذه الحقبة انبثقت من حضارة أم النار وتمت تسميتها بهذا الاسم نسبة لوادي سوق الواقع في سلطنة عمان ما بين صحار ومدينة العين.,14,ن (صف 8-9),,,,,"مفردات قانونية، علمية، دينية، سياسية،... غير متخصصة/عامة, مفردات فصيحة - سامر ٤",,,,Sawsan,1.0,,,1.0,,,,,,V,
537,20101540026,في الجزء الأول من الكتاب الأول من الأكاديميين، قدم شيشرون تقسيم الفلسفة إلى المنطق والفيزياء والأخلاق.,16,ع (صف 12),,,,,مفردات متخصصة ومفردات عربية عالية غير شائعة كثيرا في الفضاء العام. مفردات في الغالب بعيدة عن اللهجات العامية.,,,,Sawsan,1.0,,,1.0,,,,,,V,
538,20200330006,مرض فقر الدم يعرف علمياً بـ…؟  (أ) مرض لوكيميا  (ب) مرض الأنيميا  (ج) مرض الأميبيا  (د) مرض الأنفولي,14,ن (صف 8-9),,,,,مفردات قانونية، علمية، دينية، سياسية،... غير متخصصة/عامة,,,,Sawsan,1.0,,,1.0,,,,,,V,
539,20200330009,س: ما هي عاصمة ألبانيا؟  (أ) تيرانا  (ب) ساوتومي  (ج) كتمندو,12,ل (صف 5),,,,,مفردات فصيحة - سامر ٣,,,,Sawsan,1.0,,,1.0,,,,,,V,
540,20200330011,من الشاعر العربي الذي أسمه الحقيقي أحمد بن الحسين؟  (أ) أبو الطيب المتنبي  (ب) أبو فراس الحمداني  (ج) الفرزدق  (د) الأخطل,15,س (صف 10-11),,,,,المفردات المتخصصة التي لا تكفي معرفة الكلمة وحدها لفهمها، وإنما يحتاج إلى معرفة الفكرة/المفهوم لفهمها,أفكار رمزية، مجردة، عِلمية، أو شعرية وتحتاج إلى معارف لغوية ومعرفية سابقة للبناء عليها لأجل فهمها,,,Sawsan,1.0,,,1.0,,,,,,V,C
541,20200340016,فيمن نزلت سورة الحشر؟  (أ) بني المصطلق  (ب) بني قريظة  (ج) بني قينقاع  (د) بني النضير,15,س (صف 10-11),,,,,المفردات المتخصصة التي لا تكفي معرفة الكلمة وحدها لفهمها، وإنما يحتاج إلى معرفة الفكرة/المفهوم لفهمها,,,,Sawsan,1.0,,,1.0,,,,,,V,
542,20200540016,توجد شلالات فكتوريا في نهر  (أ) الكنغو  (ب) النيل  (ج) الزمبيزي  (د) النيجر,12,ل (صف 5),,,,,مفردات فصيحة - سامر ٣,,,,Sawsan,1.0,,,1.0,,,,,,V,
543,20200810018,لمن أرسل النبي هود؟  (أ) ثمود  (ب) تبع  (ج) عاد  (د) أصحاب الرس,12,ل (صف 5),,,,,مفردات فصيحة - سامر ٣,,,,Sawsan,1.0,,,1.0,,,,,,V,
544,20201100003,النهر الذي يجري في قارة أمريكا الشمالية هو نهر :  (أ) الفولقا  (ب) الدانوب  (ج) الأمازون  (د) الميسيسبي,14,ن (صف 8-9),,,,,مفردات قانونية، علمية، دينية، سياسية،... غير متخصصة/عامة,,,,Sawsan,1.0,,,1.0,,,,,,V,
545,20300540042,بدر: الرجل قوي هائل، أليس لك رجال؟,11,ك (صف 4),,,,آخر - تراكيب نحوية,,,"مستوى ""ي"" ""ليس"" فعل ماضي ناقص",,Sawsan,1.0,,,1.0,,,,,S,,
546,20400130104,دَعْني أُحِبُكَ يا أَخي وانْسَ الْعَدا,9,ط (صف 3),,,,المنادى,مفردات تصف حالات مزاجية وشعورية إيجابية وسلبية مثل الفرح، السعادة، الغضب، الأسف، الحسرة,,,,Sawsan,1.0,,,1.0,,,,,S,V,
547,20400180029,أُسَمِّعَ الآياتِ الكَريمَةَ تَسْميعًا مُتْقَنًا.,8,ح (صف 3),,,,المفعول المطلق,مفردات فصيحة - سامر ١ و سامر ٢,,,,Sawsan,1.0,,,1.0,,,,,S,V,
548,20400250016,يتعرفُ أنواعَ الفعلِ المعتلِّ .,12,ل (صف 5),,,,,مفردات فصيحة - سامر ٣,,,,Sawsan,1.0,,,1.0,,,,,,V,
549,20400300121,خلقَ الإنسانَ ويعلمُ ما يدورُ في نفسهِ,12,ل (صف 5),,,,,مفردات فصيحة - سامر ٣,,"مستوى ""ي"" لأن ""ما"" اسم موصول خُلق فعل مجهول",,Sawsan,1.0,,,1.0,,,,,,V,
550,20400430006,أُسَمِّعَ الآياتِ الكريمةَ تسميعًا مُتْقَنًا.,8,ح (صف 3),,,,المفعول المطلق,مفردات فصيحة - سامر ١ و سامر ٢,,جملة مكررة رقم 51,,Sawsan,1.0,,,1.0,,,,,S,V,
551,20600390007,وَكُنَّا نُرِيدُ مَعْرِفَةَ مَا إِذَا كَانَتْ هُنَاكَ كَوَاكِبُ أُخْرَى حَوْلَ هَذَا النَّجْمِ ،,10,ي (صف 4),,,,كان وأخواتها,,,,,Sawsan,1.0,,,1.0,,,,,S,,
552,20600400012,"وَأَضَافَ : "" إِنَّهَا لَيْسَتْ مُجَرَّدَ خُطْوَةٍ ، بَلْ هِيَ قَفْزَةٌ تَارِيخِيَّةٌ لِأَنَّهَا لَيْسَتْ كَأَيِّ رِحْلَةٍ فَضَائِيَّةٍ ،",12,ل (صف 5),,,,,"(بل - بلى - أجل - قط), مفردات فصيحة - سامر ٣",,,,Sawsan,1.0,,,1.0,,,,,,V,
553,20600700024,حَيْثُ قَامَتَا بِتَقْيِيمِ الْإِنْتَاجِ الزِّرَاعِيِّ وَالْحَيَوَانِيِّ وَالْأَمْنِ الْغِذَائِيِّ فِي الْبِلَادِ .,14,ن (صف 8-9),,,,,"مفردات فصيحة - سامر ٤, مفردات قانونية، علمية، دينية، سياسية،... غير متخصصة/عامة",,,,Sawsan,1.0,,,1.0,,,,,,V,
554,20800070025,أوبرا ميتروبوليتان .,12,ل (صف 5),,,,,مفردات فصيحة - سامر ٣,,,,Sawsan,1.0,,,1.0,,,,,,V,
