Unnamed: 0,ID,Sentence,Readability_Level_19,Unnamed: 3,عدد الكلمات,تهجئة/إملاء,تصريف واشتقاق,تراكيب نحوية,مفردات,فكرة / محتوى,ملاحظات,99,annotator,reasoning_round,98,95,100,Unnamed: 11,Orthography,word count,Morphology,syntactic,vocab,content
911,10300280005,وَكَانَ هَؤُلَاءِ الرِّجَالُ يَحْتَاجُونَ إِلَى كِلَابٍ؛ كِلَابٍ مِنْ عَيِّنَةِ باك — كِلَابٍ قَوِيَّةٍ مَفْتُولَةِ الْعَضَلَاتِ وَذَاتِ شَعْرٍ كَثِيفٍ يَحْمِيهَا مِنَ الْبَرْدِ.,12,ل (صف 5),,,,جمل اعتراضية  ( تفسير- دعاء...),,,"يمكن اعتبار ""ذات"" تأنيث ""ذو"" ولكنها لا تعامل كالأسماء الخمسة",,Sawsan,8.0,,,1.0,,,,,S,,
912,10300540072,قالت إيمي: «لا تسخرن منِّي الآن، فقد استبدلت زجاجة العطر الصغيرة التي أحضرتها بزجاجة كبيرة، وقد استنفدت كل ما لدي من مال.»,12,ل (صف 5),لا حد لعدد الكلمات المطبعية,,,,مفردات فصيحة - سامر ٣,,,,Sawsan,8.0,,,1.0,,,W,,,V,
913,10300560020,فَكَانَ هُوَ وَزَوْجَتُهُ وَصِغَارُهُمَا يَعْمَلُونَ طَوَالَ النَّهَارِ، فَيَلْتَقِطُونَ بُذُورَ الْحَشَائِشِ وَالْحَشَرَاتِ مِنْ هُنَا وَهُنَاكَ فِي سَعَادَةٍ وَمَرَحٍ طَوَالَ الْوَقْتِ، حَتَّى إِنَّ كُلَّ كَائِنٍ فِي الْجِوَارِ يَشْعُرُ بِالسَّعَادَةِ وَالْمَرَحِ كَذَلِكَ.,13,م (صف 6-7),,,,,كلمات تصف حالات نفسية عميقة مثل الاكتئاب، الضياع، الاستنفار النفسي,,,,Sawsan,8.0,,,1.0,,,,,,V,
914,10400010200,"أَضَعُ دائِرَةً حَوْلَ حَرْفِ ""الدّالِ"" مَعَ الْكَسْرَةِ (دِ):",7,ز (صف 2),,,,مفعول فيه (ظروف زمان ومكان),,,,,Sawsan,8.0,,,1.0,,,,,S,,
915,10400050207,الْحَمْدُ لِلّهِ رَبِّ الْعالَمينَ,6,و (صف 2),,,,,مفردات فصيحة - سامر ١,آخر - محتوى,"وإذا أخذنا التهجئة الاملائية فهي في المستوى ""ه"" العالمين 4 مقاطع",,Sawsan,8.0,,,1.0,,,,,,V,C
916,10400190029,سُلوكي مَسْؤولِيَّتي,6,و (صف 2),,كلمات من ٥ مقاطع (بدون حساب حركات الإعراب),,,,,,,Sawsan,8.0,,,1.0,,O,,,,,
917,10400240089,أَيْنَ يَجْلِسُ صاحِبُ السُّمُوِّ الشَّيْخُ مُحَمَّدُ بنُ راشِدٍ آلِ مَكْتومٍ – رَعاهُ اللهُ، وَلِمَ؟,12,ل (صف 5),,,,جمل اعتراضية  ( تفسير- دعاء...),,,,,Sawsan,8.0,,,1.0,,,,,S,,
918,10400360201,للشّاعرِ مُحَمَّدِ الفاضِلِ,4,د (صف 1),,,سوابق: حروف جر متصلة (ب+ ل+ ك+),,,,,,Sawsan,8.0,,,1.0,,,,M,,,
919,10400410135,قالَ تَعالَى: الْبَقْرَةِ],7,ز (صف 2),,أفعال/أسماء معتلة الآخر,,,,,,,Sawsan,8.0,,,1.0,,O,,,,,
920,10400420119,اسْتَطاعَ جَعْفَرُ بْنُ أَبي طالِبٍ إِقْناعَ النَّجاشِيِّ بِالْحِكْمَةِ وَالْعَقْلِ وَالدَّليلِ؛ حَيْثُ قالَ لَهُ‏‏: أَيُّها الْمَلِكُ، كُنّا قَوْمًا أَهْلَ جاهِلِيَّةٍ، نَعْبُدُ الْأَصْنامَ، وَنَأْكُلُ الْمَيْتَةَ، وَنَأْتي الْفَواحِشَ، وَنَقْطَعُ الْأَرْحامَ، وَنُسيءُ الْجِوارَ، وَيَأْكُلُ الْقَوِيُّ مِنّا الضَّعيفَ؛,14,ن (صف 8-9),,,,,مفردات قانونية، علمية، دينية، سياسية،... غير متخصصة/عامة,,,,Sawsan,8.0,,,1.0,,,,,,V,
921,10400450060,#__# % مِنْ مِسَاحَةِ دَوْلَةِ الْإِمَارَاتِ.,5,هـ (صف 2),,,جمع المؤنث السالم في الأسماء والصفات,,,,,,Sawsan,8.0,,,1.0,,,,M,,,
922,10500130042,"نظرت إليها ""درهمة"" في دهشةٍ ثم سألتها: ماذا تريدين يا سيدتي؟",9,ط (صف 3),,,,المنادى,,,,,Sawsan,8.0,,,1.0,,,,,S,,
923,10500210043,وكان الليل يكاد ينقشع، والفجر يكاد يطلع، فصحا أخواه، ولم يسألاه كيف قضى ليلته؟,12,ل (صف 5),,,,,مفردات فصيحة - سامر ٣,,"المستوى ""ي"" في التراكيب النحوية ""كان وأخواتها"" وعدد الكلمات، وكاد من النواسخ",,Sawsan,8.0,,,1.0,,,,,,V,
924,10500370007,"ومدينة ""كاندي"" اشتهرت بكثرة الأشجار ووفرة الزهر والثمار.. حتى أطلق عليها ""المدينة الخضراء""، أو ""كاندي الخضراء"".",10,ي (صف 4),١٥ هو أعلى عدد كلمات مطبعية غير متكررة بدون علامات الترقيم,,المبني للمجهول,,,,,,Sawsan,8.0,,,1.0,,,W,M,,,
925,10500470037,كانت هذه هي أماني لبلبة الصغيرة في الحياة، ولكنها لم تجد وسيلة يمكن أن تحقق بها أحلامها وأمانيها.,11,ك (صف 4),٢٠ هو أعلى عدد كلمات مطبعية غير متكررة بدون علامات الترقيم,,,,,,,,Sawsan,8.0,,,1.0,,,W,,,,
926,10600370010,أنرت الطريق,6,و (صف 2),,,الفعل الماضي المفرد والجمع,,,,,,Sawsan,8.0,,,1.0,,,,M,,,
927,10900010015,قبلَ النَّومِ، أنظُرُ إلى السَّمَاء,7,ز (صف 2),,,,مفعول فيه (ظروف زمان ومكان),,,,,Sawsan,8.0,,,1.0,,,,,S,,
928,10900010347,تحملُ عصيراً وأطعمة,7,ز (صف 2),,,جمع التكسير,,,,,,Sawsan,8.0,,,1.0,,,,M,,,
929,20100850025,كما تعتبر المسلات المصرية القديمة، التي شيدت حوالي عام 3500 قبل الميلاد، أيضًا من بين أقدم ساعات الظل المعروفة.,14,ن (صف 8-9),,,,,"مفردات قانونية، علمية، دينية، سياسية،... غير متخصصة/عامة, مفردات فصيحة - سامر ٤",,,,Sawsan,8.0,,,1.0,,,,,,V,
930,20101540039,على النقيض من ذلك، يرى ديفيد تشالمرز وغيرهم تقدمًا في الفلسفة مشابهًا للتقدم في العلوم، بينما قال تالبوت بروير إن «التقدم» هو المعيار الخاطئ الذي يُحْكَم من خلاله على النشاط الفلسفي.,16,ع (صف 12),,,,,مفردات متخصصة ومفردات عربية عالية غير شائعة كثيرا في الفضاء العام. مفردات في الغالب بعيدة عن اللهجات العامية.,,,,Sawsan,8.0,,,1.0,,,,,,V,
931,20300280028,وتصبح تلك الحياة لا قيمة لها عنده، وتتسرب إلى مخيلته فكرة الموت؛ فيستنبط الحيل التي تسهِّل له طريق الانتحار،,13,م (صف 6-7),,,,,كلمات تصف حالات نفسية عميقة مثل الاكتئاب، الضياع، الاستنفار النفسي,,,,Sawsan,8.0,,,1.0,,,,,,V,
932,20300360029,ولكن ما شأني أنا ملُّوا أو أقبلوا، فأنا أريد أن أتحدث، ولو كنتُ إلى غير سامع أتحدث.,11,ك (صف 4),٢٠ هو أعلى عدد كلمات مطبعية غير متكررة بدون علامات الترقيم,,,,,,"""ولو كنتُ إلى غير سامع أتحدث"" جملة شرطية مستوى ""م""",,Sawsan,8.0,,,1.0,,,W,,,,
933,20300480054,ارتفع الغبار في السماء مع الدخان وكرات من النار،,7,ز (صف 2),١٠ هو أعلى عدد كلمات مطبعية غير متكررة بدون علامات الترقيم,,,مفعول فيه (ظروف زمان ومكان),,,,,Sawsan,8.0,,,1.0,,,W,,S,,
934,20400030078,• نورُ القَمَرِ .,3,ج (صف 1),,,سوابق: ال التعريف,,,,,,Sawsan,8.0,,,1.0,,,,M,,,
935,20400090040,أُقارِنُ: بَيْنَ الجِبالِ الِالتِوائِيَّةِ وَالجِبالِ الِانْكِسارِيَّةِ حَسَبَ مُعْطَياتِ الجَدْوَلِ الآتي.,14,ن (صف 8-9),,,,,مفردات قانونية، علمية، دينية، سياسية،... غير متخصصة/عامة,,,,Sawsan,8.0,,,1.0,,,,,,V,
936,20400340053,أعبِّرُ شَفَويًّا عَنْ مُقتَرحاتي لتشجيعِ زملائي لامتهانِ العملِ اليدويِّ.,11,ك (صف 4),,,,,,آخر - محتوى,"لا أجد أي سبب في المستوى ""ك"" غير ""امتهان"" كلمة فصيحة""  تحتاج لمعرفة سابقة لفهم المقصود",,Sawsan,8.0,,,1.0,,,,,,,C
937,20400410094,قالوا: نَعَمْ، ما جَرَّبْنا عَلَيْكَ إِلاَّ صِدْقًا.,12,ل (صف 5),,,,استثناء,,,,,Sawsan,8.0,,,1.0,,,,,S,,
938,20500430019,هناك صورة مجازية مفيدة توضح كيف يعمل النظامان في العقل؛ وهي أن ترى النظام ١ باعتباره طيارًا آليٍّا والنظام ٢ باعتباره طيارًا بشريٍّا.,14,ن (صف 8-9),,,,,مفردات قانونية، علمية، دينية، سياسية،... غير متخصصة/عامة,,,,Sawsan,8.0,,,1.0,,,,,,V,
939,20500440004,لا یجوز التخلي عن أحد أقسام الأراضي اللبنانیة أو التنازل عنه.,9,ط (صف 3),١٢ هو أعلى عدد كلمات مطبعية غير متكررة بدون علامات الترقيم,,,,,,,,Sawsan,8.0,,,1.0,,,W,,,,
940,20600450010,وَأَضَافَ أَنَّ شَرِكَتَهُ اشْتَرَتْ وَاتِسْ آبْ لِأَنَّ الْأَخِيرَةَ تَضُمُّ 450 مِلْيُونِ مُسْتَخْدِمٍ دِينَامِيكِيٍّ ،,14,ن (صف 8-9),,,,,مفردات قانونية، علمية، دينية، سياسية،... غير متخصصة/عامة,,,,Sawsan,8.0,,,1.0,,,,,,V,
941,20700620009,وحتما أن تكون لوسائل التواصل الاجتماعي سلبيات ، وأولها استغلالها لنشر الشائعات غير الصحيحة مما يؤدي إلى المشاكل .,12,ل (صف 5),,,,,مفردات فصيحة - سامر ٣,,,,Sawsan,8.0,,,1.0,,,,,,V,
942,20800090031,كيف أثر الركود على الشركة ؟,12,ل (صف 5),,,,,مفردات فصيحة - سامر ٣,,,,Sawsan,8.0,,,1.0,,,,,,V,
943,20800090099,كان الشارع مزدحماً بالسيارات .,10,ي (صف 4),,,,كان وأخواتها,,,,,Sawsan,8.0,,,1.0,,,,,S,,
944,20900070005,كانت السيارة مسرعة واتجهنا إلى طريق مكة ،,10,ي (صف 4),,,,كان وأخواتها,,,,,Sawsan,8.0,,,1.0,,,,,S,,
945,21000080018,أنا أقاتل إلى جانب الحق,11,ك (صف 4),,,,إضافة خيالية (لفظية) طويل القامة,,,,,Sawsan,8.0,,,1.0,,,,,S,,
946,21100070034,وليس بغثٍّ أن تغثَّ المآكلُ,16,ع (صف 12),,,,,مفردات متخصصة ومفردات عربية عالية غير شائعة كثيرا في الفضاء العام. مفردات في الغالب بعيدة عن اللهجات العامية.,,,,Sawsan,8.0,,,1.0,,,,,,V,
947,30100470036,٤ وقد تتداخل بعض أوصاف الذات في مضمون الإيمان مع صفاتها (الواحد، الموجود، الأوَّل، القديم) دون فصل بين أوصاف الذات وصفاتها، والتعرض لمسائل المشابهة والمماثلة والجهة دون التعبير عنها بمقولاتها الخاصة وهي المخالفة للحوادث والقيام بالنفس، بل الاكتفاء بالحديث عن الاستواء وسائر الصفات الحسية المتنازع عليها.,17,ف (جامعة  1-2),,,,,مفردات عِلمية وتراثية غير متداولة اليوم وغير مألوفة لغير المتخصص المبتدئ,,,,Sawsan,8.0,,,1.0,,,,,,V,
948,30100610028,فآلهتهم وإن تكن ترمز لبعض قوى الوجود … كالضوء الذي يشتق من اسمه لفظ «زيس» zeus كبير آلهتهم، كما يمثل «رع» الشمس عند قدماء المصريين، إلا أن البون واسعٌ بين تصوُّر الشعبين لتلك الآلهة،,15,س (صف 10-11),,,,,المفردات المتخصصة التي لا تكفي معرفة الكلمة وحدها لفهمها، وإنما يحتاج إلى معرفة الفكرة/المفهوم لفهمها,,,,Sawsan,8.0,,,1.0,,,,,,V,
949,30100760039,فعلى كل حال، كان ركاب درجة رجال الأعمال يتلقَّون خدمة متميزة.,10,ي (صف 4),,,,كان وأخواتها,,,,,Sawsan,8.0,,,1.0,,,,,S,,
950,30101200026,لا يأنس بإنسان، ولا ينفك عن الكتمان،,15,س (صف 10-11),,,,,المفردات المتخصصة التي لا تكفي معرفة الكلمة وحدها لفهمها، وإنما يحتاج إلى معرفة الفكرة/المفهوم لفهمها,,,,Sawsan,8.0,,,1.0,,,,,,V,
951,30101330053,وقد تسرَّبت هذه الأسطورة في الأدب العربي، وقال بها بعض أئمتهم مما نحدِّثك عنه بعد قليل.,14,ن (صف 8-9),,,,,"مفردات قانونية، علمية، دينية، سياسية،... غير متخصصة/عامة, مفردات فصيحة - سامر ٤",,,,Sawsan,8.0,,,1.0,,,,,,V,
952,30101340040,في المواقف الاجتماعية، يُعد الإحراج علامةَ تحذير على أنَّ الوضع يسير في اتجاه خاطئ، وأنَّ شخصًا ما يتعرض للفشل عادة.,13,م (صف 6-7),,,,,كلمات تصف حالات نفسية عميقة مثل الاكتئاب، الضياع، الاستنفار النفسي,,,,Sawsan,8.0,,,1.0,,,,,,V,
953,30101440039,ولكن هجرات الرعاة كانت دائمًا سريعة نسبيًّا نظرًا لاستخدام وسائل النقل الحيوانية بالإضافة إلى التنظيم العسكري الذي يكون أساس حياة البداوة.,12,ل (صف 5),لا حد لعدد الكلمات المطبعية,,,,مفردات فصيحة - سامر ٣,,,,Sawsan,8.0,,,1.0,,,W,,,V,
954,30101460005,هو أقرب ما يكون إلى ذكريات كما اخترت العنوان،,10,ي (صف 4),,,,كان وأخواتها,أسماء الوصل المفردة,,,,Sawsan,8.0,,,1.0,,,,,S,V,
955,30101560021,إنه في غِلاف طبعته الحادية عشرة الصادرة عام ١٩٨٨، التي عاد ناشِرها إلى غلاف الطبعة الأولى الصادرة عام ١٩٧٦، الذي صمَّمه الصديق الفنان «إحسان عنتابي»، ولكن ألوانه بهتَت حتى بدَت وكأنها بلون واحد لعدم عنايةِ الناشر بتجديدِ بلاكاتها المتآكلة من تعدُّد الطبعات التي صدرت منذ ذلك الوقت.,14,ن (صف 8-9),,,,,"مفردات قانونية، علمية، دينية، سياسية،... غير متخصصة/عامة, مفردات فصيحة - سامر ٤",,,,Sawsan,8.0,,,1.0,,,,,,V,
956,30200140004,المركب العضوي الذي يخزن في أكباد الحيوانات :  (أ) غاليكوجين وهو سكر متعدد  (ب) غاليكوجين وهو سكر ثنائي  (ج) أميلوبكتين وهو سكر متعدد  (د) أميلوز وهو سكر متعدد,16,ع (صف 12),,,,,مفردات متخصصة ومفردات عربية عالية غير شائعة كثيرا في الفضاء العام. مفردات في الغالب بعيدة عن اللهجات العامية.,,,,Sawsan,8.0,,,1.0,,,,,,V,
957,30200660015,أحد النقوش البارزة  (أ) الأثار  (ب) الأوستراكا  (ج) صلابة الملك نعرمر,15,س (صف 10-11),,,,,المفردات المتخصصة التي لا تكفي معرفة الكلمة وحدها لفهمها، وإنما يحتاج إلى معرفة الفكرة/المفهوم لفهمها,,,,Sawsan,8.0,,,1.0,,,,,,V,
958,30300040002,أشكال لا نهائية غاية في الجمال,12,ل (صف 5),,,,,مفردات فصيحة - سامر ٣,,,,Sawsan,8.0,,,1.0,,,,,,V,
959,30300230014,في ذلك السوق توجد كميات قليلة من السلاحف البرية البيضاء ذوات الدرقات الأصغر من المعتاد، فضلًا عن وجود بعض العاج كما في ميناء أدوليس.,12,ل (صف 5),لا حد لعدد الكلمات المطبعية,,,,"مفردات فصيحة - سامر ٣, ذو",,"""ذوات"" جمع ""ذات"" ملحقة ب ""ذو""",,Sawsan,8.0,,,1.0,,,W,,,V,
960,30300390026,لم يكن العجز شديدًا حتى يتطلب استخدام العكازات،,10,ي (صف 4),,,,كان وأخواتها,,,,,Sawsan,8.0,,,1.0,,,,,S,,
961,30400020071,إن حرية تكوين الجمعيات والاتحادات وفقاً للمبادئ الوطنية والأهداف المشروعة والوسائل السلمية مكفولة وفقاً للقواعد والشروط التي ينص عليها القانون، شريطة عدم المساس بأسس الدين والنظام العام، ولا يجوز إجبار أحد على الانضمام إلى أي جمعية أو اتحاد أو الاستمرار في عضويته.,14,ن (صف 8-9),,,,,مفردات قانونية، علمية، دينية، سياسية،... غير متخصصة/عامة,,,,Sawsan,8.0,,,1.0,,,,,,V,
962,30400120021,تعمل السلطة الوطنية الفلسطينية دون إبطاء لتصبح طرفاً في الإعلانات والمواثيق الإقليمية والدولية التي تحمي حقوق الإنسان.,14,ن (صف 8-9),,,,,"مفردات فصيحة - سامر ٤, مفردات قانونية، علمية، دينية، سياسية،... غير متخصصة/عامة",,,,Sawsan,8.0,,,1.0,,,,,,V,
963,30400140044,الشهادة في سبيل الوطن قيمة عليا، وتكفل الدولة ذوي الشهداء وفقاً للقانون.,14,ن (صف 8-9),,,,,مفردات قانونية، علمية، دينية، سياسية،... غير متخصصة/عامة,,,,Sawsan,8.0,,,1.0,,,,,,V,
964,30600140004,3 وَلِمَاذَا تَنْظُرُ الْقَذَى الَّذِي فِي عَيْنِ أَخِيكَ، وَأَمَّا الْخَشَبَةُ الَّتِي فِي عَيْنِكَ فَلاَ تَفْطَنُ لَهَا؟,14,ن (صف 8-9),,,,,"مفردات فصيحة - سامر ٤, مفردات قانونية، علمية، دينية، سياسية،... غير متخصصة/عامة",,,,Sawsan,8.0,,,1.0,,,,,,V,
965,30900070026,هَلْ تُبْلِغَنِّي دَارَهَـا شَدَنِيَّـةٌ لُعِنَتْ بِمَحْرُومِ الشَّرَابِ مُصَـرَّمِ,17,ف (جامعة  1-2),,,,,مفردات عِلمية وتراثية غير متداولة اليوم وغير مألوفة لغير المتخصص المبتدئ,,,,Sawsan,8.0,,,1.0,,,,,,V,
966,31100160001,وصار الديوان كزهر البستان,10,ي (صف 4),,,,كان وأخواتها,,,,,Sawsan,8.0,,,1.0,,,,,S,,
967,31100190016,وقال لها هاتي السمك للسلطان,12,ل (صف 5),,,,,,آخر - محتوى,"مستوى ""ح"" لأنّ الواو سوابق وهاتي فعل أمر وليس اسم فاعل ""هيتَ""",,Sawsan,8.0,,,1.0,,,,,,,C
968,10100080031,أي إلى معلم يقرأ القرآن وأنت تستمعين إليه.. وتقلدينه.,8,ح (صف 3),,,,,مفردات فصيحة - سامر ١ و سامر ٢,,,,Sawsan,8.0,,,1.0,,,,,,V,
969,10100140035,وهناك أيضا الصبر على المصائب والنوائب،,12,ل (صف 5),,,,,مفردات فصيحة - سامر ٣,,,,Sawsan,8.0,,,1.0,,,,,,V,
970,10100200035,قال المساعد: إلى أين سنتجه...؟,8,ح (صف 3),,,سوابق أخرى: سين الاستقبال ، واو الاستئناف، فاء العطف,,,,,,Sawsan,8.0,,,1.0,,,,M,,,
971,10400040124,الْمُعَلِّمَةُ	: سَنَعْمَلُ يا أَبْنائي في مَجْموعاتٍ مُتَعاوِنَةٍ.,9,ط (صف 3),,,,المنادى,,,,,Sawsan,8.0,,,1.0,,,,,S,,
972,10400310058,ما واجِبُ الطُّلّابِ تُجاهَ مَنْ يُعَلِّمُهُمْ؟,7,ز (صف 2),,,جمع التكسير,,,,"""من"" اسم موصول توضع في المستوى ""ي""",,Sawsan,8.0,,,1.0,,,,M,,,
973,10400310109,ماذا أقرأ؟,5,هـ (صف 2),,,,أدوات استفهام أساسية: ماذا، متى، من، أين، ما،كيف,,,,,Sawsan,8.0,,,1.0,,,,,S,,
974,10400390093,أَشْطُبُ وَزَميلي الكَلِمَةَ غَيْرَ المُنْتَمِيَةِ لِمَجْموعَةِ الضَّمائِرِ المُنْفَصِلَةِ:,8,ح (صف 3),,,,,أحرف النفي,,,,Sawsan,8.0,,,1.0,,,,,,V,
975,10400470019,لَعِبَتِ المَرْأَةُ أَدْوارًا رَئيسَةً في عَمَلِيَّةِ التَّنْمِيَةِ الَّتي تَشْهَدُها دَوْلَةُ الإِماراتِ العَرَبِيَّةِ المُتَّحِدَةِ،,12,ل (صف 5),,,,,مفردات فصيحة - سامر ٣,,,,Sawsan,8.0,,,1.0,,,,,,V,
976,20100150034,في سنة 1874 اقترح الفيزيائي الإيرلندي جورج ستوني بعد دراسة هذه ظاهرة التحليل الكهربائي بأن هناك «كمية محددة واحدة من الكهرباء»، وهي شحنة من أيون أحادي التكافؤ.,14,ن (صف 8-9),,,,,مفردات قانونية، علمية، دينية، سياسية،... غير متخصصة/عامة,,,,Sawsan,8.0,,,1.0,,,,,,V,
977,20500070004,سأل الأب ولده: “هل أنت جاهز للاختبار؟”، قال له: “هذا الأمر يعود إلى زميلي الذي يجلس بجواري”.,11,ك (صف 4),٢٠ هو أعلى عدد كلمات مطبعية غير متكررة بدون علامات الترقيم,,,,,,,,Sawsan,8.0,,,1.0,,,W,,,,
978,30100480025,فأوجِّه إليهم شكري.,8,ح (صف 3),,,سوابق أخرى: سين الاستقبال ، واو الاستئناف، فاء العطف,,,,,,Sawsan,8.0,,,1.0,,,,M,,,
979,30300010028,البرج الذي قرر الأمير الشاب العيش فيه، منذ الوفاة المريبة لوالده، ينتصب كمثل حارس مصاب بالجرب منسي، في طرف الحديقة الملكية، على شاطئ البحر الذي هو بحر للجميع.,13,م (صف 6-7),,,,,كلمات تصف حالات نفسية عميقة مثل الاكتئاب، الضياع، الاستنفار النفسي,," ""منذ الوفاة المريبة لوالده"" خطأ ",,Sawsan,8.0,,,1.0,,,,,,V,
980,10102500011,سأستأثر به,12,ل (صف 5),,,,,مفردات فصيحة - سامر ٣,,,,Sawsan,8.0,,,1.0,,,,,,V,
981,10400160031,ثالِثًا: أُناقِشُ زُمَلائي لِتَحْديدِ الْأَحْداثِ الرَّئيسَةِ:,12,ل (صف 5),,,,,مفردات فصيحة - سامر ٣,,,,Sawsan,8.0,,,1.0,,,,,,V,
982,10400320116,يَشْرَحُ تَأْثيرَ المَوارِدِ الطَّبيعِيَّةِ وَالبَشَرِيَّةِ في المُجْتَمَعِ.,14,ن (صف 8-9),,,,,مفردات قانونية، علمية، دينية، سياسية،... غير متخصصة/عامة,,,,Sawsan,8.0,,,1.0,,,,,,V,
983,10400340095,أُلاحِظُ المُخَطَّطَ الآتِيَ، وَأَسْتَنْتِجُ شَفَوِيًّا عَوامِلَ قِيامِ الصِّناعَةِ في بلادي:,12,ل (صف 5),,,,,مفردات فصيحة - سامر ٣,,,,Sawsan,8.0,,,1.0,,,,,,V,
984,20100230008,وقام بعدها عبد الرحمٰن الناصر لِدين الله بإعلان الخِلافة الأُمويَّة عوض الإمارة، لِأسبابٍ سياسيَّة خارجيَّة في الغالب،,15,س (صف 10-11),,,,,المفردات المتخصصة التي لا تكفي معرفة الكلمة وحدها لفهمها، وإنما يحتاج إلى معرفة الفكرة/المفهوم لفهمها,,,,Sawsan,8.0,,,1.0,,,,,,V,
985,20400230040,فَهَذا الإِرْثُ هُوَ إِرْثٌ عَظيمٌ لَيْسَ لِشَعْبٍ مِنَ الشُّعوبِ فَقَطْ، بَلْ لِلْإِنْسانِيَّةِ جَمْعاءَ.,12,ل (صف 5),,,,,"(بل - بلى - أجل - قط), مفردات فصيحة - سامر ٣",,,,Sawsan,8.0,,,1.0,,,,,,V,
986,20400550069,فهذا الصّنفُ يأخذُ كتابَه بيمينِه يومَ القيامةِ، فيدخلونَ الجنّةَ لإيمانِهم وأعمالِهمُ الصّالحةِ.,14,ن (صف 8-9),,,,,مفردات قانونية، علمية، دينية، سياسية،... غير متخصصة/عامة,,,,Sawsan,8.0,,,1.0,,,,,,V,
987,20500880005,ولها أنواع كثيرة ويغلب استعمال نوعين منها في الرسم هي:,10,ي (صف 4),,,,خبر مقدم / مبتدأ مؤخر,,,,,Sawsan,8.0,,,1.0,,,,,S,,
