Unnamed: 0,ID,Sentence,Readability_Level_19,Unnamed: 3,عدد الكلمات,تهجئة/إملاء,تصريف واشتقاق,تراكيب نحوية,مفردات,فكرة / محتوى,ملاحظات,99,annotator,reasoning_round,98,95,100,Unnamed: 11,Orthography,word count,Morphology,syntactic,vocab,content
1346,20300560020,وهي قطعة رثَّة ذات حواف مُهترئة من جلد الدِّبَبة، وبها فتحة في المنتصف أدخل منها رأسه.,11,ك (صف 4),٢٠ هو أعلى عدد كلمات مطبعية غير متكررة بدون علامات الترقيم,,,,,,,,Zeina,7.0,1.0,,,,,W,,,,
1347,20300580032,فنظرًا لأن الاقتصاديين يُعْنَون في الأساس بدراسةِ تداول النقود وإنتاج الأشياء واستهلاكها، فإن لديهم تحيُّزًا متأصِّلًا تجاه افتراضِ أن المال والمادة هما كلُّ ما يهمُّ.,15,س (صف 10-11),,,,,المفردات المتخصصة التي لا تكفي معرفة الكلمة وحدها لفهمها، وإنما يحتاج إلى معرفة الفكرة/المفهوم لفهمها,,,,Zeina,7.0,1.0,,,,,,,,V,
1348,20400420056,أستنبطَ الحكمةَ منْ مشروعيةِ هذهِ السننِ.,15,س (صف 10-11),,,,,المفردات المتخصصة التي لا تكفي معرفة الكلمة وحدها لفهمها، وإنما يحتاج إلى معرفة الفكرة/المفهوم لفهمها,,,,Zeina,7.0,1.0,,,,,,,,V,
1349,20400450030,الأمنُ الوطنيُّ,12,ل (صف 5),,,,,مفردات فصيحة - سامر ٣,,,,Zeina,7.0,1.0,,,,,,,,V,
1350,20400490058,السّفرِ وتنوُّعِهِ: .,5,هـ (صف 2),,كلمات من ٤ مقاطع (بدون حساب حركات الإعراب),,,,,,,Zeina,7.0,1.0,,,,O,,,,,
1351,20600430019,وَتَنَاوَلَ عَيِّنَاتٍ مِنْ أَفْضَلِ وَأَشْمَلِ الْبُحُوثِ الَّتِي فَحَصَهَا وَدَقَّقَهَا ،,14,ن (صف 8-9),,,,,مفردات قانونية، علمية، دينية، سياسية،... غير متخصصة/عامة,,,,Zeina,7.0,1.0,,,,,,,,V,
1352,20700240003,في هذه الأيام التكنولوجيا قضت على كل شيء من خلال الهواتف ،,8,ح (صف 3),١١ هو أعلى عدد كلمات مطبعية غير متكررة بدون علامات الترقيم,,,,,,,,Zeina,7.0,1.0,,,,,W,,,,
1353,20700440004,ولكن في الحقيقة منذ انتشرت هذه الوسائل توقف الناس عن التجمع مع بعضهم وقطعوا صلة الرحم واعتبروا هذه الوسائل كطريقة أسهل لكي يباركوا للناس ويهنئوهم بدلا أن يحضروا .,12,ل (صف 5),لا حد لعدد الكلمات المطبعية,,,,مفردات فصيحة - سامر ٣,,,,Zeina,7.0,1.0,,,,,W,,,V,
1354,20700510004,وقد تغير كل شيء فور اكتشاف حقول البترول التي ساهمت وبشكل كبير في تنمية الدولة بشكل اقتصادي وحضاري .,14,ن (صف 8-9),,,,,مفردات قانونية، علمية، دينية، سياسية،... غير متخصصة/عامة,,,,Zeina,7.0,1.0,,,,,,,,V,
1355,20700800018,فذلك من صفات والدنا وقائدنا الشيخ زايد رحمه الله ،,12,ل (صف 5),,,,جمل اعتراضية  ( تفسير- دعاء...),,,,,Zeina,7.0,1.0,,,,,,,S,,
1356,20800150046,أجل ، أريد مشاهدة معالم المدينة .,12,ل (صف 5),,,,,(بل - بلى - أجل - قط),,,,Zeina,7.0,1.0,,,,,,,,V,
1357,20900080007,كنت مستعدا,10,ي (صف 4),,,,كان وأخواتها,,,,,Zeina,7.0,1.0,,,,,,,S,,
1358,30100210018,(٢) الكون ملائم للحياة,12,ل (صف 5),,,,,مفردات فصيحة - سامر ٣,,,,Zeina,7.0,1.0,,,,,,,,V,
1359,30100370005,طغت على بدايات القرن الحادي والعشرين عمليات العولمة المتناقضة والمضطربة، ولكن يبدو أن تخمينَ ما هو على المحك أمرٌ بالغُ الصعوبة؛,15,س (صف 10-11),,,,,المفردات المتخصصة التي لا تكفي معرفة الكلمة وحدها لفهمها، وإنما يحتاج إلى معرفة الفكرة/المفهوم لفهمها,,,,Zeina,7.0,1.0,,,,,,,,V,
1360,30100610002,نشر الدكتور لويس عوض كُتيبًا عن «المسرح المصري»، جمع فيه سلسلةً من المقالات كان قد نشرها بجريدة الجمهورية،,12,ل (صف 5),,,,,مفردات فصيحة - سامر ٣,,,,Zeina,7.0,1.0,,,,,,,,V,
1361,30100640035,لهفي على طيب ليال خَلَتْ بجانب البطحاء من قابسِ,17,ف (جامعة  1-2),,,,,مفردات عِلمية وتراثية غير متداولة اليوم وغير مألوفة لغير المتخصص المبتدئ,,,,Zeina,7.0,1.0,,,,,,,,V,
1362,30100650034,وقالوا: إن الشمس تغيب في هذا البرج أو ذاك بحسب غيابها في شهور السنة،,10,ي (صف 4),,,,إن وأخواتها,,,,,Zeina,7.0,1.0,,,,,,,S,,
1363,30100860048,يظهر في الشكل نسخة من قناع أصلي لإسحاق نيوتن تحتفظ به الجمعية الملكية بلندن.,14,ن (صف 8-9),,,,,مفردات قانونية، علمية، دينية، سياسية،... غير متخصصة/عامة,,,,Zeina,7.0,1.0,,,,,,,,V,
1364,30101060016,حتى إذا كان عهد الحملة الفرنسية نقص عدد البكوات، فلم يزيدوا عند خروج الفرنسيين من مصر على الاثني عشر «بك»،,13,م (صف 6-7),,,,الجمل شرطية ( مركبة - عادية),,,,,Zeina,7.0,1.0,,,,,,,S,,
1365,30101550078,النيل العذب هو الكوثر والجنة شاطئه الأخضر,14,ن (صف 8-9),,,,,مفردات قانونية، علمية، دينية، سياسية،... غير متخصصة/عامة,,,,Zeina,7.0,1.0,,,,,,,,V,
1366,30101580051,ومفادُها أنَّ الحياة وبيئتها غير الحية على كوكب الأرض تكوِّنان نظامًا ذاتيَّ التنظيم يُبقي مُناخ الأرض وتركيب الغِلاف الجوي صالحَين لوجود حياة فيهما.,14,ن (صف 8-9),,,,,مفردات قانونية، علمية، دينية، سياسية،... غير متخصصة/عامة,,,,Zeina,7.0,1.0,,,,,,,,V,
1367,30101660051,كان لكل فصل من هذا الكتاب، أثناء وجوده على الويكي، «مسئول فصل».,10,ي (صف 4),,,,كان وأخواتها,,,,,Zeina,7.0,1.0,,,,,,,S,,
1368,30200150011,جميع القواعد التالية تدخل في تركيب DNA ما عدا :  (أ) ادنين  (ب) ثايمين  (ج) يوراسيل  (د) سايتوسين,16,ع (صف 12),,,,,مفردات متخصصة ومفردات عربية عالية غير شائعة كثيرا في الفضاء العام. مفردات في الغالب بعيدة عن اللهجات العامية.,,,,Zeina,7.0,1.0,,,,,,,,V,
1369,30200450018,التخطيط لحركة المرور والطرق هو من فوائد التخطيط:  (أ) البيئية  (ب) الصحية  (ج) الاجتماعية  (د) الاقتصادية,14,ن (صف 8-9),,,,,مفردات قانونية، علمية، دينية، سياسية،... غير متخصصة/عامة,,,,Zeina,7.0,1.0,,,,,,,,V,
1370,30200460008,يقاس اتجاه الرياح بجهاز:  (أ) الثيرموميتر  (ب) دوارة الرياح  (ج) الباروجراف  (د) الانيموميترذو الفناجين,14,ن (صف 8-9),,,,,مفردات قانونية، علمية، دينية، سياسية،... غير متخصصة/عامة,,,,Zeina,7.0,1.0,,,,,,,,V,
1371,30300050105,بعد دقيقة بدون موضوع,8,ح (صف 3),,,,,أحرف النفي,,,,Zeina,7.0,1.0,,,,,,,,V,
1372,30300550076,- هل تسدي لي خدمة؟,12,ل (صف 5),,,,,مفردات فصيحة - سامر ٣,,,,Zeina,7.0,1.0,,,,,,,,V,
1373,30400060102,يعلن الأمير الحكم العرفي في أحوال الضرورة التي يحددها القانون، وبالإجراءات المنصوص عليها فيه. ويكون إعلان الحكم العرفي بمرسوم، ويعرض هذا المرسوم على مجلس الأمة خلال الخمسة عشر يوماً التالية له للبت في مصير الحكم العرفي. وإذا حدث ذلك في فترة الحل وجب عرض الأمر على المجلس الجديد في أول اجتماع له.,16,ع (صف 12),,,,,مفردات متخصصة ومفردات عربية عالية غير شائعة كثيرا في الفضاء العام. مفردات في الغالب بعيدة عن اللهجات العامية.,,,,Zeina,7.0,1.0,,,,,,,,V,
1374,30400110071,ويتولى صاحب الجلالة السلطان المهام التالية:,11,ك (صف 4),,,,إضافة خيالية (لفظية) طويل القامة,,,,,Zeina,7.0,1.0,,,,,,,S,,
1375,30500200007,يعدد أنواع التهديدات التي تواجه محطات تحلية المياه.,10,ي (صف 4),,,,,أسماء الوصل المفردة,,,,Zeina,7.0,1.0,,,,,,,,V,
1376,30500200018,ما موضوع الصورة؟,5,هـ (صف 2),,,,أدوات استفهام أساسية: ماذا، متى، من، أين، ما،كيف,,,,,Zeina,7.0,1.0,,,,,,,S,,
1377,30600120032,31 «وَقِيلَ: مَنْ طَلَّقَ امْرَأَتَهُ فَلْيُعْطِهَا كِتَابَ طَلاَق.,13,م (صف 6-7),,,,الجمل شرطية ( مركبة - عادية),,,,,Zeina,7.0,1.0,,,,,,,S,,
1378,31000270004,إِذَا اؤْتُمِنَ خَانَ وَإِذَا حَدَّثَ كَذَبَ وَإِذَا عَاهَدَ غَدَرَ ، وَإِذَا خَاصَمَ فَجَرَ,13,م (صف 6-7),,,,الجمل شرطية ( مركبة - عادية),,,,,Zeina,7.0,1.0,,,,,,,S,,
1379,10100200017,وكان معهم آنية من الفخار وأخرى من الجلد، فملئوها من ماء النبع، وربطوها فوق ظهور البغال المخصصة لحمل آنية الماء وأكياس الطعام،,11,ك (صف 4),,,,,,آخر - محتوى,22 كلمة-مستوى(ل),,Zeina,7.0,1.0,,,,,,,,,C
1380,10400310074,سُلوكي مَسْؤولِيَّتي,6,و (صف 2),,كلمات من ٥ مقاطع (بدون حساب حركات الإعراب),,,,,,,Zeina,7.0,1.0,,,,O,,,,,
1381,11100010058,الشتاء,3,ج (صف 1),,,سوابق: ال التعريف,,,,,,Zeina,7.0,1.0,,,,,,M,,,
1382,20100010003,وكان غزير الأدب والشعر، وافر العلم، غايةً في الفهم، عالمًا بِاللُّغة، حاذقًا بِالنحو.,14,ن (صف 8-9),,,,,مفردات قانونية، علمية، دينية، سياسية،... غير متخصصة/عامة,,,,Zeina,7.0,1.0,,,,,,,,V,
1383,20200100005,‏توجد مياه عفرا في‎  (أ) الطفيلة  (ب) الشونة الشمالية  (ج) مادبا  (د) عمان,12,ل (صف 5),,,,,مفردات فصيحة - سامر ٣,,,,Zeina,7.0,1.0,,,,,,,,V,
1384,30100190030,ويوجد عامل نفسي في الموضة يمكنه التأثير بعمق على المستهلك (على سبيل المثال، شعور بالثقة أو شعور غامر بالقوة) عند ارتدائه لنوع معين من الملابس أو الأحذية أو الحُليِّ أو حتى عند وضعه لعطر معين،,13,م (صف 6-7),,,,,كلمات تصف حالات نفسية عميقة مثل الاكتئاب، الضياع، الاستنفار النفسي,,,,Zeina,7.0,1.0,,,,,,,,V,
1385,30400130056,تطور الدولة الاقتصاد الوطني وتديره بغرض تحقيق الرخاء عن طريق سياسات تهدف لزيادة الإنتاج وبناء اقتصاد كفء معتمد على ذاته وتشجيع السوق الحُر ومنع الاحتكار.,15,س (صف 10-11),,,,,المفردات المتخصصة التي لا تكفي معرفة الكلمة وحدها لفهمها، وإنما يحتاج إلى معرفة الفكرة/المفهوم لفهمها,,,,Zeina,7.0,1.0,,,,,,,,V,
1386,30700140009,8 وَسَمِعَا صَوْتَ الرَّبِّ الإِلهِ مَاشِيًا فِي الْجَنَّةِ عِنْدَ هُبُوبِ رِيحِ النَّهَارِ، فَاخْتَبَأَ آدَمُ وَامْرَأَتُهُ مِنْ وَجْهِ الرَّبِّ الإِلهِ فِي وَسَطِ شَجَرِ الْجَنَّةِ.,14,ن (صف 8-9),,,,,مفردات قانونية، علمية، دينية، سياسية،... غير متخصصة/عامة,آخر - محتوى,,,Zeina,7.0,1.0,,,,,,,,V,C
1387,31000040003,فَرَفَعْتُ بَصَرِي فَإِذَا الْمَلَكُ الَّذِي جَاءَنِي بِحِرَاءٍ جَالِسٌ عَلَى كُرْسِيٍّ بَيْنَ السَّمَاءِ وَالأَرْضِ ،,12,ل (صف 5),,,,,مفردات فصيحة - سامر ٣,,,,Zeina,7.0,1.0,,,,,,,,V,
1388,10300070025,تسألني ما هي «نيفرلاند»؟,8,ح (صف 3),,,,جملة فعلية تتعدى إلى مفعولين,,,,,Zeina,7.0,1.0,,,,,,,S,,
1389,10400320015,يَشْرَحُ تَأْثيرَ المَوارِدِ الطَّبيعِيَّةِ وَالبَشَرِيَّةِ في المُجْتَمَعِ.,14,ن (صف 8-9),,,,,مفردات قانونية، علمية، دينية، سياسية،... غير متخصصة/عامة,,,,Zeina,7.0,1.0,,,,,,,,V,
1390,10400340089,أَقْرَأُ التَّقْريرَ الآتِيَ، وَأُجيبُ شَفَوِيًّا:,7,ز (صف 2),,,,حال,,,,,Zeina,7.0,1.0,,,,,,,S,,
1391,20100220004,امتهن الكتابة في ديوان الرسائل في شبابه,12,ل (صف 5),,,,,مفردات فصيحة - سامر ٣,,,,Zeina,7.0,1.0,,,,,,,,V,
1392,20400280084,بِالْعَوْدَةِ إِلى حَواشي النَّصِّ، وَشَبَكَةِ الْمَعْلوماتِ، أَوْ إِلى أَيِّ مَصْدَرٍ آخَرَ مِنْ مَصادِرِ التَّعَلُّمِ أَمْلَأُ البِطاقَةَ الآتِيَةَ:,11,ك (صف 4),٢٠ هو أعلى عدد كلمات مطبعية غير متكررة بدون علامات الترقيم,,,,,,,,Zeina,7.0,1.0,,,,,W,,,,
1393,30200280009,النظام الخبير الذي يحدد مكونات المركبات الكيمائية :  (أ) باف  (ب) بروسبكتر  (ج) ليثان  (د) ديندرال,14,ن (صف 8-9),,,,,مفردات قانونية، علمية، دينية، سياسية،... غير متخصصة/عامة,,,,Zeina,7.0,1.0,,,,,,,,V,
1394,30400160036,المساواة ، والعدالة الاجتماعية ، وتوفير الأمن والطمأنينة ، وتكافؤ الفرص لجميع المواطنين ، من دعامات المجتمع ، والتعاضد والتراحم صلة وثقى بينهم .,14,ن (صف 8-9),,,,,مفردات قانونية، علمية، دينية، سياسية،... غير متخصصة/عامة,,,,Zeina,7.0,1.0,,,,,,,,V,
1395,30800340003,لَكِنِ الَّذِينَ اتَّقَوْا رَبَّهُمْ لَهُمْ جَنَّاتٌ تَجْرِي مِنْ تَحْتِهَا الْأَنْهَارُ خَالِدِينَ فِيهَا نُزُلًا مِنْ عِنْدِ اللَّهِ وَمَا عِنْدَ اللَّهِ خَيْرٌ لِلْأَبْرَارِ (198),14,ن (صف 8-9),,,,,مفردات قانونية، علمية، دينية، سياسية،... غير متخصصة/عامة,آخر - محتوى,,,Zeina,7.0,1.0,,,,,,,,V,C
1396,10100290023,سوف أقدم في هذا الباب مواد جديدة.,8,ح (صف 3),,,سوابق أخرى: سين الاستقبال ، واو الاستئناف، فاء العطف,,,,,1.0,Zeina,8.0,,,,,,,M,,,
1397,10100320015,صنعاء – اليمن,3,ج (صف 1),,,سوابق: ال التعريف,,,,,1.0,Zeina,8.0,,,,,,,M,,,
1398,10100330133,ويقال إنها لما بلغت 500 سنة أحرقت نفسها وبرزت من دخانها عنقاء أخرى..,14,ن (صف 8-9),,,,,مفردات قانونية، علمية، دينية، سياسية،... غير متخصصة/عامة,,,1.0,Zeina,8.0,,,,,,,,,V,
1399,10100710034,خسائر كبرى!,7,ز (صف 2),,أفعال/أسماء معتلة الآخر,جمع التكسير,,,,,1.0,Zeina,8.0,,,,,O,,M,,,
1400,10100940012,"وهو عبارة عن لوحة شرف تحمل أسماء 47 شهيدًا ضحوا بأرواحهم لتحقيق النصر في معركة جزيرة ""شدوان"" البحرية عام 1970م أيام حرب الاستنزاف، ",14,ن (صف 8-9),,,,,مفردات قانونية، علمية، دينية، سياسية،... غير متخصصة/عامة,,,1.0,Zeina,8.0,,,,,,,,,V,
1401,10100960037,أطفال وحيوانات وعمال سيرك..,7,ز (صف 2),,,جمع التكسير,,,,,1.0,Zeina,8.0,,,,,,,M,,,
1402,10101170031,بيوت - من خيوط.,7,ز (صف 2),,,جمع التكسير,,,,,1.0,Zeina,8.0,,,,,,,M,,,
1403,10101170092,دافيد هارت ولد عادي،,7,ز (صف 2),,أفعال/أسماء معتلة الآخر,,,,,,1.0,Zeina,8.0,,,,,O,,,,,
1404,10101520143,استمر هذا الحال فترة طويلة من العام الدراسي فلم نكن قد انسجمنا مع معلمتنا الجديدة ولذلك لم نكن نستوعب الدرس منها جيداً.,12,ل (صف 5),لا حد لعدد الكلمات المطبعية,,,,مفردات فصيحة - سامر ٣,,,1.0,Zeina,8.0,,,,,,W,,,V,
1405,10101690008,كل سمكة تحمل على عينيها ضوءاً يشبه أضواء سيارة في ظلام الليل،,9,ط (صف 3),١٢ هو أعلى عدد كلمات مطبعية غير متكررة بدون علامات الترقيم,,,,,,,1.0,Zeina,8.0,,,,,,W,,,,
1406,10101930008,ولا أدري ماذا أكتب فيه..,8,ح (صف 3),,,,,أحرف النفي,,,1.0,Zeina,8.0,,,,,,,,,V,
1407,10102680027,تسعة..,2,ب (صف 1),,,,,العدد الأصلي بالأحرف,,,1.0,Zeina,8.0,,,,,,,,,V,
1408,10102710021,كلا النوعين له مظهر جميل بجسمه البني المحمر والشرائط ذات اللون البني الرمادي أو المصفر، التي تساعده على الاختباء.,11,ك (صف 4),٢٠ هو أعلى عدد كلمات مطبعية غير متكررة بدون علامات الترقيم,,,,,,,1.0,Zeina,8.0,,,,,,W,,,,
1409,10200760011,يعد تأثير المياه الجوفية على الصخور تحت الأرض مثالا على:  (أ) التجوية الكيميائية  (ب) التجوية الحيوية  (ج) التجوية الفيزيائية  (د) التعرية,14,ن (صف 8-9),,,,,مفردات قانونية، علمية، دينية، سياسية،... غير متخصصة/عامة,,,1.0,Zeina,8.0,,,,,,,,,V,
1410,10300230004,كان الليل قارص البرودة، وكنا نسمع دويَّ الرياح عندما أهلَّ علينا للمرة الأولى البحار العجوز ذو الوجه النديب.,12,ل (صف 5),,,,,"ذو, مفردات فصيحة - سامر ٣",,,1.0,Zeina,8.0,,,,,,,,,V,
1411,10300520009,وَهُوَ حَادُّ الْبَصَرِ قَلَّمَا يَمُرُّ شَيْءٌ دُونَ أَنْ يَلْحَظَهُ؛ لِذَا بَيْنَمَا كَانَ يَقْفِزُ مِنْ شَجَرَةٍ لِأُخْرَى، لَمَحَ شَيْئًا فِي الْأَسْفَلِ عَلَى الْأَرْضِ أَثَارَ فُضُولَهُ.,13,م (صف 6-7),,,,,استخدام كلمات منحوتة غير متداولة (الهجرع للخفيف الأحمق مشتقة من هرع و هجع),,,1.0,Zeina,8.0,,,,,,,,,V,
1412,10300610044,عندما فتح جوناثان قاموسه الصغير للبحث عن معنى الكلمة — فور أن جلس في العربة — وجد أنها كانت تعني إما «مستذئبًا» أو «مصاص دماء» باللغة الصربية.,12,ل (صف 5),,,,جمل اعتراضية  ( تفسير- دعاء...),,,,1.0,Zeina,8.0,,,,,,,,S,,
1413,10400060073,رَحْمَنُ يا رَحْمَن,9,ط (صف 3),,,,المنادى,,,,1.0,Zeina,8.0,,,,,,,,S,,
1414,10400060078,رَحْمَنُ يا رَحْمَن,9,ط (صف 3),,,,المنادى,,,,1.0,Zeina,8.0,,,,,,,,S,,
1415,10400370041,الْجُمْلَةُ الْفِعْليَّةُ (2),5,هـ (صف 2),,كلمات من ٤ مقاطع (بدون حساب حركات الإعراب),,,,,,1.0,Zeina,8.0,,,,,O,,,,,
1416,10400400170,عَلامَ يَدُلُّ ذَلِكَ؟,10,ي (صف 4),,,,,(ممّا – عمّا – عمَّ – علامَ – فيمَ – إلامَ - بمَ...),,,1.0,Zeina,8.0,,,,,,,,,V,
1417,10400420055,سُلوكي مَسْؤولِيَّتي:,6,و (صف 2),,كلمات من ٥ مقاطع (بدون حساب حركات الإعراب),,,,,,1.0,Zeina,8.0,,,,,O,,,,,
1418,10500030048,نعم إنها ملابس جميلة.,10,ي (صف 4),,,,إن وأخواتها,,,,1.0,Zeina,8.0,,,,,,,,S,,
1419,10500050004,الطبعة السادسة عشرة,5,هـ (صف 2),,,,,العدد الترتيبي,,,1.0,Zeina,8.0,,,,,,,,,V,
1420,10500320024,"فتارة يمسك دفة القارب، وتارة يحرك المجدافين، وابنه ""حسان"" يلقي الشبكة في البحر ويشدها، ويفرغ في قعر القارب ما يصطاد...",12,ل (صف 5),,,,,مفردات فصيحة - سامر ٣,,,1.0,Zeina,8.0,,,,,,,,,V,
1421,10500400024,وبعد أشهر وضعت ‹‹مبروكة›› بنتا جميلةً أسمتها ‹‹هناء››..,8,ح (صف 3),,,سوابق أخرى: سين الاستقبال ، واو الاستئناف، فاء العطف,,,,,1.0,Zeina,8.0,,,,,,,M,,,
1422,10500490034,وقعد الثلاثة يبحثون ويدبرون.. ويفكرون: ماذا يعملون...؟!,8,ح (صف 3),,,سوابق أخرى: سين الاستقبال ، واو الاستئناف، فاء العطف,,,,,1.0,Zeina,8.0,,,,,,,M,,,
1423,10600370024,أنرت الطريق,6,و (صف 2),,,الفعل الماضي المفرد والجمع,,,,,1.0,Zeina,8.0,,,,,,,M,,,
1424,20100170015,تستخدم التسميتين بشكل متساو، وتترجم إلى اللغة العربية والإنكليزية تحت اسم «الإمبراطورية المغولية» أو «إمبراطورية المغول».,14,ن (صف 8-9),,,,,مفردات قانونية، علمية، دينية، سياسية،... غير متخصصة/عامة,,,1.0,Zeina,8.0,,,,,,,,,V,
1425,20100190026,0,11,ك (صف 4),,,,إضافة خيالية (لفظية) طويل القامة,,,,1.0,Zeina,8.0,,,,,,,,S,,
1426,20100300009,كما تم اختيارها كواحدة من عجائب الدنيا السبع الجديدة عام 2007.,12,ل (صف 5),,,,,مفردات فصيحة - سامر ٣,,,1.0,Zeina,8.0,,,,,,,,,V,
1427,20100350010,في العصور القديمة كانت هذه المنطقة إحدى مقاطعات بلاد فارس وتُعرف باسم «الديلم» (أحياناً «الديلمان» أو «الديلام»).,14,ن (صف 8-9),,,,,مفردات قانونية، علمية، دينية، سياسية،... غير متخصصة/عامة,,,1.0,Zeina,8.0,,,,,,,,,V,
1428,20101080004,كانت في بدايتها تغطي ثلاث مجالاتٍ هي خدمة الإسلام، والدراسات الإسلامية، واللغة العربية والأدب؛,14,ن (صف 8-9),,,,,مفردات قانونية، علمية، دينية، سياسية،... غير متخصصة/عامة,,,1.0,Zeina,8.0,,,,,,,,,V,
1429,20101160006,لم تنضب عين أبي لوزة إلا في الثمانينيات، وهذا يعني تأخرها في النضوب عن سائر العيون التي نضبت في المحافظة.,12,ل (صف 5),,,,,مفردات فصيحة - سامر ٣,,,1.0,Zeina,8.0,,,,,,,,,V,
1430,20101210004,تبدأ الاستعدادت مع دخول النصف الثاني من شهر شعبان,7,ز (صف 2),,,,مفعول فيه (ظروف زمان ومكان),,,,1.0,Zeina,8.0,,,,,,,,S,,
1431,20101390024,وصلت قوة البطال وقوة مالك حتى أكرونيون المعروفة اليوم بأفيون قره حصار، ولكن تواجه وهُزم من قبل البيزنطيين بقيادة الإمبراطور ليون (الحاكم من: 717م - 741م) وولده قسطنطين في معركة أفيون قره حصار.,14,ن (صف 8-9),,,,,مفردات قانونية، علمية، دينية، سياسية،... غير متخصصة/عامة,,,1.0,Zeina,8.0,,,,,,,,,V,
1432,20101420001,عذراء فلاديمير أو سيدة فلاديمير (بالروسية: Влади́мирская ико́на Бо́жией Ма́тери)‏، (بالأوكرانية: Вишгородська ікона Божої Матері)‏، وتسمى أيضاً والدة الإله فلاديمير (باليونانية: Θεοτόκος του Βλαντίμιρ)‏، هي أيقونة بيزنطية من القرن الثاني عشر الميلادي وواحدة من أكثر الأيقونات شهرة في التاريخ السلافي ، تُصوِّر العذراء والطفل يسوع، وهي من أوائل النماذج لأيقونة عذراء الرحمة.,14,ن (صف 8-9),,,,,مفردات قانونية، علمية، دينية، سياسية،... غير متخصصة/عامة,,,1.0,Zeina,8.0,,,,,,,,,V,
1433,20101620003,هو بلد ديمقراطي جمهوري طوائفي.,14,ن (صف 8-9),,,,,مفردات قانونية، علمية، دينية، سياسية،... غير متخصصة/عامة,,,1.0,Zeina,8.0,,,,,,,,,V,
